{"admission_id_sha256":"sha256:0331d32bdc4522287211319fd2ba70f291442f7abc1293a189472650e0cdd5e2","artifact_inventory_sha256":"sha256:dbc3eb99b0e671587ad667947cf6956b4d19b46718b0fa2ed82295938d89cd14","authority_state_sha256":"sha256:df5079141df68877c4b06f05b9fb9fdf279307b7629eb1f2dce12def4bd5e2fa","claim_scope":"production_openadapt","evidence_class":"remote-safe-synthetic","expires_at":null,"issued_at":"2026-09-02T19:22:47Z","issuer":{"environment":"production-release-admission","ref":"refs/heads/main","repository":"OpenAdaptAI/.github","repository_id":"858454062","repository_owner_id":"132681217","source_commit":"78aebd3c98e66943eb3da0144945199300f16323","workflow":".github/workflows/issue-production-release-admission.yml"},"not_before":"2026-09-02T19:22:47Z","production_acceptance_summary_bundle_reference":{"kind":"production-acceptance-summary-sigstore-bundle","object_media_type":"application/vnd.dev.sigstore.bundle.v0.3+json","object_path":"production-evidence/objects/sha256/f4/f492452c7481aa9dec48d317c58cc4f5564cd4bcd437f115873fd71d5fba8a3c.production-acceptance-summary-sigstore-bundle.json","object_schema_version":"application/vnd.dev.sigstore.bundle.v0.3+json","object_sha256":"sha256:f492452c7481aa9dec48d317c58cc4f5564cd4bcd437f115873fd71d5fba8a3c","registry_entry_sha256":"sha256:6369def764073661cc264651fc21aa159369a41a41952d427b7ea8cdc326f89c","registry_head_sha256":"sha256:ca736c81feed5f73a94975dc36ada22384dac108cf11d8fcb82d96cc1aaa0907","registry_revision":1,"registry_source_commit":"78aebd3c98e66943eb3da0144945199300f16323","repository":"OpenAdaptAI/.github","repository_id":"858454062","repository_owner_id":"132681217","schema_version":"openadapt.production-evidence-object-reference/v2","semantic_identity_sha256":"sha256:27bc1c22eb7957d6fc32d3c684001059f2bda6197332737f09132514369cd362","size_bytes":2789,"subject_sha256":"sha256:430830dca4e7f2310ad5a0251cb3bbbc08c285bb1ae79bf629361c3000148ec0"},"production_acceptance_summary_reference":{"kind":"production-acceptance-summary","object_media_type":"application/vnd.openadapt.production-lifecycle-evidence-summary+json;version=3","object_path":"production-evidence/objects/sha256/43/430830dca4e7f2310ad5a0251cb3bbbc08c285bb1ae79bf629361c3000148ec0.production-acceptance-summary.json","object_schema_version":"openadapt.production-lifecycle-evidence-summary/v3","object_sha256":"sha256:430830dca4e7f2310ad5a0251cb3bbbc08c285bb1ae79bf629361c3000148ec0","registry_entry_sha256":"sha256:4bc01ce31b4cef2ace209e24613fdb31caff760c9f9222dd59b3dbc743d6aa77","registry_head_sha256":"sha256:ca736c81feed5f73a94975dc36ada22384dac108cf11d8fcb82d96cc1aaa0907","registry_revision":1,"registry_source_commit":"78aebd3c98e66943eb3da0144945199300f16323","repository":"OpenAdaptAI/.github","repository_id":"858454062","repository_owner_id":"132681217","schema_version":"openadapt.production-evidence-object-reference/v2","semantic_identity_sha256":"sha256:b83fb88c0635c2d8636e8d80587a671260c6778b23585a7bfab81a530b642ebf","size_bytes":14436,"subject_sha256":null},"publication_policy_sha256":"sha256:ed5ab69fe8127604ca674263cbc8c774b7cfd10754e90bfaa9b71ba573bce1d1","publication_staging":{"assets":[{"asset_id":"531103238","kind":"python-wheel","media_type":"application/zip","name":"openadapt-1.16.0-py3-none-any.whl","publish_destinations":["github-release","pypi"],"sha256":"sha256:371693e7607d1cdc1ea360ef5d657c1af791a0af39677fa2ce5933e7ba712719","size_bytes":22539,"uploader_id":"41898282","uploader_login":"github-actions[bot]"},{"asset_id":"531103250","kind":"python-sdist","media_type":"application/gzip","name":"openadapt-1.16.0.tar.gz","publish_destinations":["github-release","pypi"],"sha256":"sha256:39d01612417dff5981b536b324a63498df1ea6f0128c723276609ebbe18d9a18","size_bytes":47028,"uploader_id":"41898282","uploader_login":"github-actions[bot]"}],"draft":false,"draft_release_id":"377301614","immutable_releases":{"enabled":true,"enforced_by_owner":false},"immutable_releases_sha256":"sha256:07649aafb167237fecc138f5e93b48ddce5a69f4060da7130e3c78e59fd48581","observed_at":"2026-09-02T19:22:47Z","prerelease":false,"publication_mode":"already-published-pypi","pypi_files":[{"filename":"openadapt-1.16.0-py3-none-any.whl","packagetype":"bdist_wheel","sha256":"sha256:371693e7607d1cdc1ea360ef5d657c1af791a0af39677fa2ce5933e7ba712719","size_bytes":22539,"yanked":false},{"filename":"openadapt-1.16.0.tar.gz","packagetype":"sdist","sha256":"sha256:39d01612417dff5981b536b324a63498df1ea6f0128c723276609ebbe18d9a18","size_bytes":47028,"yanked":false}],"release_app_bot_user_id":"321543906","release_app_id":"4730708","release_app_installation_id":"156835568","release_author_login":"abrichr","repository":"OpenAdaptAI/OpenAdapt","repository_id":"627024850","schema_version":"openadapt.production-release-staging-evidence/v1","tag":"v1.16.0","tag_ref_state":{"exists":true,"ref":"refs/tags/v1.16.0"},"tag_ref_state_sha256":"sha256:9a8aa745a01492ba6d7123a35015bb26a7b6dbf689cbbc598f24e6692c6cbe1f","tag_rulesets":[{"bypass_actors":[{"actor_id":"4730708","actor_type":"Integration","bypass_mode":"always"}],"conditions":{"ref_name":{"exclude":[],"include":["refs/tags/v*"]}},"enforcement":"active","name":"OpenAdapt policy: release tag creation","repository":"OpenAdaptAI/OpenAdapt","repository_id":"627024850","role":"creation_authority","rules":[{"type":"creation"}],"ruleset_id":"10","schema_version":"openadapt.production-release-tag-ruleset/v1","target":"tag"},{"bypass_actors":[],"conditions":{"ref_name":{"exclude":[],"include":["refs/tags/v*"]}},"enforcement":"active","name":"OpenAdapt policy: immutable release tags","repository":"OpenAdaptAI/OpenAdapt","repository_id":"627024850","role":"immutability","rules":[{"type":"deletion"},{"type":"non_fast_forward"},{"parameters":{"update_allows_fetch_and_merge":false},"type":"update"}],"ruleset_id":"11","schema_version":"openadapt.production-release-tag-ruleset/v1","target":"tag"}],"tag_rulesets_sha256":"sha256:a3e21df5f68f21867b648fd2c570b2857af806f29169bb3b4995bb73c19cc48c","target_commitish":"089c27c046f5cd972d299361f9d68285c1896c71"},"publication_staging_sha256":"sha256:610f69126edc52d55792c92169dd52d4951d461cb5653782b56669be6d2a2f24","release":{"artifacts":[{"kind":"python-sdist","media_type":"application/gzip","name":"openadapt-1.16.0.tar.gz","publish_destinations":["github-release","pypi"],"sha256":"sha256:39d01612417dff5981b536b324a63498df1ea6f0128c723276609ebbe18d9a18","size_bytes":47028},{"kind":"python-wheel","media_type":"application/zip","name":"openadapt-1.16.0-py3-none-any.whl","publish_destinations":["github-release","pypi"],"sha256":"sha256:371693e7607d1cdc1ea360ef5d657c1af791a0af39677fa2ce5933e7ba712719","size_bytes":22539}],"deployment_id":null,"deployment_sha256":null,"kind":"package","schema_version":"openadapt.production-release-candidate/v1","source_commit":"089c27c046f5cd972d299361f9d68285c1896c71","source_repository":"OpenAdaptAI/OpenAdapt","source_repository_id":"627024850","tag":"v1.16.0","version":"1.16.0"},"release_identity":{"channel":"production","previous_admission_sha256":null,"schema_version":"openadapt.monotonic-production-release/v1","sequence":1},"release_sha256":"sha256:99b3306efdaaa0e5f324a83230156d85323bc53a6219d07e8d443006abf70a9f","revocation_state_sha256":"sha256:250ab430e467f5e584ebd2b1832976b42186b698da71d627ee1724c2b1da2457","schema_version":"openadapt.qualification-release/v2","signer_registry_sha256":"sha256:e243a23243b24986ed08812e284a1bd8c4993814149f02bcba79cc520e10ca14","target":"openadapt","verdict":"accepted"}
