{"admission_id_sha256":"sha256:8075cc5b24a8825be4f225eadaf69be0a77133834e5e7697fa21d3c1c2ebc619","artifact_inventory_sha256":"sha256:972a7511829f703774eb5def0ffb20bc823a6c598b217a4fab4c3c3b6dcdeb1a","authority_state_sha256":"sha256:df5079141df68877c4b06f05b9fb9fdf279307b7629eb1f2dce12def4bd5e2fa","claim_scope":"production_docs","evidence_class":"remote-safe-synthetic","expires_at":null,"issued_at":"2026-09-02T19:22:47Z","issuer":{"environment":"production-release-admission","ref":"refs/heads/main","repository":"OpenAdaptAI/.github","repository_id":"858454062","repository_owner_id":"132681217","source_commit":"78aebd3c98e66943eb3da0144945199300f16323","workflow":".github/workflows/issue-production-release-admission.yml"},"not_before":"2026-09-02T19:22:47Z","production_acceptance_summary_bundle_reference":{"kind":"production-acceptance-summary-sigstore-bundle","object_media_type":"application/vnd.dev.sigstore.bundle.v0.3+json","object_path":"production-evidence/objects/sha256/4a/4a27e05914ac70bc27acaf970b6ce0d101e463f28158bb6e49788c0596882153.production-acceptance-summary-sigstore-bundle.json","object_schema_version":"application/vnd.dev.sigstore.bundle.v0.3+json","object_sha256":"sha256:4a27e05914ac70bc27acaf970b6ce0d101e463f28158bb6e49788c0596882153","registry_entry_sha256":"sha256:9d6f590acab1b42d4fd8c7d0560744f737f5f2674de9b95f331be37a0a86984b","registry_head_sha256":"sha256:b7b499a3ceb079e2d9d0c20892ece19505fafdba1b63212b16b2e1275c44289c","registry_revision":1,"registry_source_commit":"78aebd3c98e66943eb3da0144945199300f16323","repository":"OpenAdaptAI/.github","repository_id":"858454062","repository_owner_id":"132681217","schema_version":"openadapt.production-evidence-object-reference/v2","semantic_identity_sha256":"sha256:d16b2145f5e2450b86745a6d56bed27c83689a90a22f2156b22f4b1b529e703f","size_bytes":2789,"subject_sha256":"sha256:14044106048baa6c920a6804ee713fb2856b042fe1a0c86fc4780663221832b8"},"production_acceptance_summary_reference":{"kind":"production-acceptance-summary","object_media_type":"application/vnd.openadapt.production-lifecycle-evidence-summary+json;version=3","object_path":"production-evidence/objects/sha256/14/14044106048baa6c920a6804ee713fb2856b042fe1a0c86fc4780663221832b8.production-acceptance-summary.json","object_schema_version":"openadapt.production-lifecycle-evidence-summary/v3","object_sha256":"sha256:14044106048baa6c920a6804ee713fb2856b042fe1a0c86fc4780663221832b8","registry_entry_sha256":"sha256:d05ac276ca321871cec4229d66841a0664399fb7686c86d35f45124df322a6f3","registry_head_sha256":"sha256:b7b499a3ceb079e2d9d0c20892ece19505fafdba1b63212b16b2e1275c44289c","registry_revision":1,"registry_source_commit":"78aebd3c98e66943eb3da0144945199300f16323","repository":"OpenAdaptAI/.github","repository_id":"858454062","repository_owner_id":"132681217","schema_version":"openadapt.production-evidence-object-reference/v2","semantic_identity_sha256":"sha256:fb1190ddf9610a4cced93d1dcd7d9b3d1450c04c3fcb36b0a309871df5725ac3","size_bytes":12373,"subject_sha256":null},"publication_policy_sha256":"sha256:ed5ab69fe8127604ca674263cbc8c774b7cfd10754e90bfaa9b71ba573bce1d1","publication_staging":{"assets":[{"asset_id":null,"kind":"deployment-manifest","media_type":"application/vnd.openadapt.production-deployment-manifest+json;version=1","name":"openadapt-docs-e323249e3a7c1af9d7651312e0afe1f12c38c977.deployment-manifest.json","publish_destinations":["deployment"],"sha256":"sha256:be6da3476e1149d5101056a1ecab2f32db129fe876ff4b3703a9fcddde77569d","size_bytes":468,"uploader_id":null,"uploader_login":null}],"deployment_id":"6226957122","deployment_url":"https://docs.openadapt.ai","draft":false,"observed_at":"2026-09-02T19:22:47Z","prerelease":false,"publication_mode":"already-published-deployment","pypi_files":null,"repository":"OpenAdaptAI/openadapt-ops","repository_id":"1172011294","schema_version":"openadapt.production-release-staging-evidence/v1","tag":"v0.0.0-deployment.6226957122","target_commitish":"e323249e3a7c1af9d7651312e0afe1f12c38c977"},"publication_staging_sha256":"sha256:d1d677f8285998d7e1d7a046e5a187271c2679974582de006a1b2d4046026aee","release":{"artifacts":[{"kind":"deployment-manifest","media_type":"application/vnd.openadapt.production-deployment-manifest+json;version=1","name":"openadapt-docs-e323249e3a7c1af9d7651312e0afe1f12c38c977.deployment-manifest.json","publish_destinations":["deployment"],"sha256":"sha256:be6da3476e1149d5101056a1ecab2f32db129fe876ff4b3703a9fcddde77569d","size_bytes":468}],"deployment_id":"6226957122","deployment_sha256":"sha256:be6da3476e1149d5101056a1ecab2f32db129fe876ff4b3703a9fcddde77569d","kind":"deployment","schema_version":"openadapt.production-release-candidate/v1","source_commit":"e323249e3a7c1af9d7651312e0afe1f12c38c977","source_repository":"OpenAdaptAI/openadapt-ops","source_repository_id":"1172011294","tag":null,"version":null},"release_identity":{"channel":"production","previous_admission_sha256":null,"schema_version":"openadapt.monotonic-production-release/v1","sequence":1},"release_sha256":"sha256:dd52dc34cd3fd4cb70c0cd45eb0f4e341b4db1c210a51513f126be7b01f05713","revocation_state_sha256":"sha256:250ab430e467f5e584ebd2b1832976b42186b698da71d627ee1724c2b1da2457","schema_version":"openadapt.qualification-release/v2","signer_registry_sha256":"sha256:e243a23243b24986ed08812e284a1bd8c4993814149f02bcba79cc520e10ca14","target":"docs","verdict":"accepted"}
