{"admission_id_sha256":"sha256:d2983b86d5428c892421b191f6943a63cf4f9a0b1629e324d099f5df6fa5dcda","artifact_inventory_sha256":"sha256:ec3ef7c177c493bebee3da60f170b37793832e81066e9d9ee785d5fa225a5ac5","authority_state_sha256":"sha256:df5079141df68877c4b06f05b9fb9fdf279307b7629eb1f2dce12def4bd5e2fa","claim_scope":"production_flow","evidence_class":"remote-safe-synthetic","expires_at":null,"issued_at":"2026-09-02T18:24:25Z","issuer":{"environment":"production-release-admission","ref":"refs/heads/main","repository":"OpenAdaptAI/.github","repository_id":"858454062","repository_owner_id":"132681217","source_commit":"2c129702da718522cc257913207b6ed6f3b33b7c","workflow":".github/workflows/issue-production-release-admission.yml"},"not_before":"2026-09-02T18:24:25Z","production_acceptance_summary_bundle_reference":{"kind":"production-acceptance-summary-sigstore-bundle","object_media_type":"application/vnd.dev.sigstore.bundle.v0.3+json","object_path":"production-evidence/objects/sha256/e9/e9ecdee1fc3458906fc91f5760d215bb5bec3591a6ed9ae0b412114e24fcf8fb.production-acceptance-summary-sigstore-bundle.json","object_schema_version":"application/vnd.dev.sigstore.bundle.v0.3+json","object_sha256":"sha256:e9ecdee1fc3458906fc91f5760d215bb5bec3591a6ed9ae0b412114e24fcf8fb","registry_entry_sha256":"sha256:7dc2fcab09f705356a22b058b9e7f078596bcdefdb697bef7315510d17931549","registry_head_sha256":"sha256:9a9f597b0d87674c4d36c022227201a5d8f3072237624346793692c3a863d12e","registry_revision":1,"registry_source_commit":"2c129702da718522cc257913207b6ed6f3b33b7c","repository":"OpenAdaptAI/.github","repository_id":"858454062","repository_owner_id":"132681217","schema_version":"openadapt.production-evidence-object-reference/v2","semantic_identity_sha256":"sha256:1b5606b9f4c14edd37ec134a9c716a070832b8709e3c2f9c6f4186ff514b7c82","size_bytes":2789,"subject_sha256":"sha256:3849fd4e2cae0d3a74964362e4850870bb68c23007d5eb818800159d3eb730d4"},"production_acceptance_summary_reference":{"kind":"production-acceptance-summary","object_media_type":"application/vnd.openadapt.production-lifecycle-evidence-summary+json;version=3","object_path":"production-evidence/objects/sha256/38/3849fd4e2cae0d3a74964362e4850870bb68c23007d5eb818800159d3eb730d4.production-acceptance-summary.json","object_schema_version":"openadapt.production-lifecycle-evidence-summary/v3","object_sha256":"sha256:3849fd4e2cae0d3a74964362e4850870bb68c23007d5eb818800159d3eb730d4","registry_entry_sha256":"sha256:932511112a7eb5f296b752953ac184516a47f7630643ecf70955af722e78ef68","registry_head_sha256":"sha256:9a9f597b0d87674c4d36c022227201a5d8f3072237624346793692c3a863d12e","registry_revision":1,"registry_source_commit":"2c129702da718522cc257913207b6ed6f3b33b7c","repository":"OpenAdaptAI/.github","repository_id":"858454062","repository_owner_id":"132681217","schema_version":"openadapt.production-evidence-object-reference/v2","semantic_identity_sha256":"sha256:cf65d1d351869c63e88d7188d1e78727994cc3f6e76c88f5643a61d168a84445","size_bytes":14497,"subject_sha256":null},"publication_policy_sha256":"sha256:ed5ab69fe8127604ca674263cbc8c774b7cfd10754e90bfaa9b71ba573bce1d1","publication_staging":{"assets":[{"asset_id":"534029483","kind":"python-wheel","media_type":"application/zip","name":"openadapt_flow-1.34.0-py3-none-any.whl","publish_destinations":["github-release","pypi"],"sha256":"sha256:56d32818989cb3a92830080ead39e10b08718c55e00988117f22cbfeaac98854","size_bytes":1928194,"uploader_id":"321543906","uploader_login":"openadapt-release[bot]"},{"asset_id":"534029484","kind":"python-sdist","media_type":"application/gzip","name":"openadapt_flow-1.34.0.tar.gz","publish_destinations":["github-release","pypi"],"sha256":"sha256:a941a70015fe91897e655bfc9bf83e6cf8fbcf8bd4e4c7206ffb133c505203f8","size_bytes":20440838,"uploader_id":"321543906","uploader_login":"openadapt-release[bot]"}],"draft":false,"draft_release_id":"378603192","immutable_releases":{"enabled":true,"enforced_by_owner":false},"immutable_releases_sha256":"sha256:07649aafb167237fecc138f5e93b48ddce5a69f4060da7130e3c78e59fd48581","observed_at":"2026-09-02T18:24:25Z","prerelease":false,"publication_mode":"already-published-pypi","pypi_files":[{"filename":"openadapt_flow-1.34.0-py3-none-any.whl","packagetype":"bdist_wheel","sha256":"sha256:56d32818989cb3a92830080ead39e10b08718c55e00988117f22cbfeaac98854","size_bytes":1928194,"yanked":false},{"filename":"openadapt_flow-1.34.0.tar.gz","packagetype":"sdist","sha256":"sha256:a941a70015fe91897e655bfc9bf83e6cf8fbcf8bd4e4c7206ffb133c505203f8","size_bytes":20440838,"yanked":false}],"release_app_bot_user_id":"321543906","release_app_id":"4730708","release_app_installation_id":"156835568","release_author_login":"openadapt-release[bot]","repository":"OpenAdaptAI/openadapt-flow","repository_id":"1291376938","schema_version":"openadapt.production-release-staging-evidence/v1","tag":"v1.34.0","tag_ref_state":{"exists":true,"ref":"refs/tags/v1.34.0"},"tag_ref_state_sha256":"sha256:74c5665395ed98ba3fd1b3a284bab1e8089f7c79cfafb3f88548e8b1456c5782","tag_rulesets":[{"bypass_actors":[{"actor_id":"4730708","actor_type":"Integration","bypass_mode":"always"}],"conditions":{"ref_name":{"exclude":[],"include":["refs/tags/v*"]}},"enforcement":"active","name":"OpenAdapt policy: release tag creation","repository":"OpenAdaptAI/openadapt-flow","repository_id":"1291376938","role":"creation_authority","rules":[{"type":"creation"}],"ruleset_id":"10","schema_version":"openadapt.production-release-tag-ruleset/v1","target":"tag"},{"bypass_actors":[],"conditions":{"ref_name":{"exclude":[],"include":["refs/tags/v*"]}},"enforcement":"active","name":"OpenAdapt policy: immutable release tags","repository":"OpenAdaptAI/openadapt-flow","repository_id":"1291376938","role":"immutability","rules":[{"type":"deletion"},{"type":"non_fast_forward"},{"parameters":{"update_allows_fetch_and_merge":false},"type":"update"}],"ruleset_id":"11","schema_version":"openadapt.production-release-tag-ruleset/v1","target":"tag"}],"tag_rulesets_sha256":"sha256:b0fdf160d80ae7dc8ffd979b2ba101cee6b3e7cf139e8c5d32b5534cbc0f7f44","target_commitish":"30fc60e55778a0e0f92b9776117cafcfe2512249"},"publication_staging_sha256":"sha256:861175c196cfe9455ce5f0536b6b1eabf55a990ced03349b865643f52316dedd","release":{"artifacts":[{"kind":"python-sdist","media_type":"application/gzip","name":"openadapt_flow-1.34.0.tar.gz","publish_destinations":["github-release","pypi"],"sha256":"sha256:a941a70015fe91897e655bfc9bf83e6cf8fbcf8bd4e4c7206ffb133c505203f8","size_bytes":20440838},{"kind":"python-wheel","media_type":"application/zip","name":"openadapt_flow-1.34.0-py3-none-any.whl","publish_destinations":["github-release","pypi"],"sha256":"sha256:56d32818989cb3a92830080ead39e10b08718c55e00988117f22cbfeaac98854","size_bytes":1928194}],"deployment_id":null,"deployment_sha256":null,"kind":"package","schema_version":"openadapt.production-release-candidate/v1","source_commit":"30fc60e55778a0e0f92b9776117cafcfe2512249","source_repository":"OpenAdaptAI/openadapt-flow","source_repository_id":"1291376938","tag":"v1.34.0","version":"1.34.0"},"release_identity":{"channel":"production","previous_admission_sha256":null,"schema_version":"openadapt.monotonic-production-release/v1","sequence":1},"release_sha256":"sha256:f84c03c857bda8372d39bc30afcc2986247778c34b3f93a39ec9de5dd151a289","revocation_state_sha256":"sha256:250ab430e467f5e584ebd2b1832976b42186b698da71d627ee1724c2b1da2457","schema_version":"openadapt.qualification-release/v2","signer_registry_sha256":"sha256:e243a23243b24986ed08812e284a1bd8c4993814149f02bcba79cc520e10ca14","target":"flow","verdict":"accepted"}
